{
  "bounds": {
    "bottom": 2115.0,
    "left": 0.0,
    "right": 952.0,
    "top": 0.0
  },
  "coordinate_space": "playfield",
  "format": "pinmame-vpx-spatial-candidates",
  "objects": [
    {
      "name": "Bumper1",
      "type": "Bumper",
      "x": 0.850556,
      "y": 0.190585
    },
    {
      "name": "Bumper2",
      "type": "Bumper",
      "x": 0.572618,
      "y": 0.170149
    },
    {
      "name": "Bumper3",
      "type": "Bumper",
      "x": 0.678274,
      "y": 0.248195
    },
    {
      "name": "Flasher001",
      "type": "Flasher",
      "x": 0.052512,
      "y": 0.023645
    },
    {
      "name": "Flasher008",
      "type": "Flasher",
      "x": 0.052512,
      "y": 0.023645
    },
    {
      "name": "LeftFlipper",
      "type": "Flipper",
      "x": 0.337294,
      "y": 0.843702
    },
    {
      "name": "RightFlipper",
      "type": "Flipper",
      "x": 0.670104,
      "y": 0.843702
    },
    {
      "name": "Gate1",
      "type": "Gate",
      "x": 0.931201,
      "y": 0.874468
    },
    {
      "name": "Gate2",
      "type": "Gate",
      "x": 0.486461,
      "y": 0.113114
    },
    {
      "name": "sw12",
      "type": "Gate",
      "x": 0.327846,
      "y": 0.144712
    },
    {
      "name": "sw37",
      "type": "Gate",
      "x": 0.932986,
      "y": 0.078329
    },
    {
      "name": "sw43",
      "type": "Gate",
      "x": 0.833001,
      "y": 0.227022
    },
    {
      "name": "sw49",
      "type": "Gate",
      "x": 0.059913,
      "y": 0.129527
    },
    {
      "name": "sw33",
      "type": "HitTarget",
      "x": 0.119478,
      "y": 0.482516
    },
    {
      "name": "sw34",
      "type": "HitTarget",
      "x": 0.110369,
      "y": 0.509405
    },
    {
      "name": "sw35",
      "type": "HitTarget",
      "x": 0.104143,
      "y": 0.53494
    },
    {
      "name": "sw36",
      "type": "HitTarget",
      "x": 0.096849,
      "y": 0.560767
    },
    {
      "name": "sw40",
      "type": "HitTarget",
      "x": 0.857786,
      "y": 0.546374
    },
    {
      "name": "sw41",
      "type": "HitTarget",
      "x": 0.857282,
      "y": 0.572942
    },
    {
      "name": "sw42",
      "type": "HitTarget",
      "x": 0.858139,
      "y": 0.599872
    },
    {
      "name": "sw44",
      "type": "HitTarget",
      "x": 0.209845,
      "y": 0.329704
    },
    {
      "name": "sw45",
      "type": "HitTarget",
      "x": 0.418357,
      "y": 0.246073
    },
    {
      "name": "sw46",
      "type": "HitTarget",
      "x": 0.530688,
      "y": 0.22219
    },
    {
      "name": "sw47",
      "type": "HitTarget",
      "x": 0.612559,
      "y": 0.296493
    },
    {
      "name": "sw48",
      "type": "HitTarget",
      "x": 0.691207,
      "y": 0.305243
    },
    {
      "name": "sw50",
      "type": "HitTarget",
      "x": 0.682681,
      "y": 0.394552
    },
    {
      "name": "BallRelease",
      "type": "Kicker",
      "x": 0.89338,
      "y": 0.872784
    },
    {
      "name": "Drain",
      "type": "Kicker",
      "x": 0.509244,
      "y": 0.962937
    },
    {
      "name": "sw10",
      "type": "Kicker",
      "x": 0.198816,
      "y": 0.198564
    },
    {
      "name": "GI_1",
      "type": "Light",
      "x": 0.243513,
      "y": 0.815492
    },
    {
      "name": "GI_10",
      "type": "Light",
      "x": 0.746088,
      "y": 0.727383
    },
    {
      "name": "GI_11",
      "type": "Light",
      "x": 0.260815,
      "y": 0.706821
    },
    {
      "name": "GI_12",
      "type": "Light",
      "x": 0.227718,
      "y": 0.718604
    },
    {
      "name": "GI_13",
      "type": "Light",
      "x": 0.287581,
      "y": 0.756694
    },
    {
      "name": "GI_14",
      "type": "Light",
      "x": 0.258334,
      "y": 0.761219
    },
    {
      "name": "GI_15",
      "type": "Light",
      "x": 0.725801,
      "y": 0.754172
    },
    {
      "name": "GI_16",
      "type": "Light",
      "x": 0.723242,
      "y": 0.767345
    },
    {
      "name": "GI_17",
      "type": "Light",
      "x": 0.910052,
      "y": 0.589073
    },
    {
      "name": "GI_18",
      "type": "Light",
      "x": 0.910154,
      "y": 0.590071
    },
    {
      "name": "GI_19",
      "type": "Light",
      "x": 0.067641,
      "y": 0.535557
    },
    {
      "name": "GI_2",
      "type": "Light",
      "x": 0.243615,
      "y": 0.817071
    },
    {
      "name": "GI_20",
      "type": "Light",
      "x": 0.067328,
      "y": 0.536556
    },
    {
      "name": "GI_21",
      "type": "Light",
      "x": 0.073451,
      "y": 0.47868
    },
    {
      "name": "GI_22",
      "type": "Light",
      "x": 0.073553,
      "y": 0.479678
    },
    {
      "name": "GI_23",
      "type": "Light",
      "x": 0.90694,
      "y": 0.548591
    },
    {
      "name": "GI_24",
      "type": "Light",
      "x": 0.907042,
      "y": 0.552246
    },
    {
      "name": "GI_25",
      "type": "Light",
      "x": 0.073866,
      "y": 0.427966
    },
    {
      "name": "GI_26",
      "type": "Light",
      "x": 0.073553,
      "y": 0.428964
    },
    {
      "name": "GI_27",
      "type": "Light",
      "x": 0.065981,
      "y": 0.366886
    },
    {
      "name": "GI_28",
      "type": "Light",
      "x": 0.066083,
      "y": 0.365227
    },
    {
      "name": "GI_29",
      "type": "Light",
      "x": 0.085439,
      "y": 0.619406
    },
    {
      "name": "GI_3",
      "type": "Light",
      "x": 0.748555,
      "y": 0.8223
    },
    {
      "name": "GI_30",
      "type": "Light",
      "x": 0.081497,
      "y": 0.616484
    },
    {
      "name": "GI_31",
      "type": "Light",
      "x": 0.91441,
      "y": 0.469153
    },
    {
      "name": "GI_32",
      "type": "Light",
      "x": 0.914511,
      "y": 0.470152
    },
    {
      "name": "GI_33",
      "type": "Light",
      "x": 0.59875,
      "y": 0.275407
    },
    {
      "name": "GI_34",
      "type": "Light",
      "x": 0.598421,
      "y": 0.275434
    },
    {
      "name": "GI_35",
      "type": "Light",
      "x": 0.184873,
      "y": 0.26742
    },
    {
      "name": "GI_36",
      "type": "Light",
      "x": 0.184975,
      "y": 0.268418
    },
    {
      "name": "GI_39",
      "type": "Light",
      "x": 0.200435,
      "y": 0.296279
    },
    {
      "name": "GI_4",
      "type": "Light",
      "x": 0.748312,
      "y": 0.822625
    },
    {
      "name": "GI_40",
      "type": "Light",
      "x": 0.200537,
      "y": 0.297277
    },
    {
      "name": "GI_41",
      "type": "Light",
      "x": 0.267662,
      "y": 0.220629
    },
    {
      "name": "GI_42",
      "type": "Light",
      "x": 0.267764,
      "y": 0.221627
    },
    {
      "name": "GI_43",
      "type": "Light",
      "x": 0.227201,
      "y": 0.163751
    },
    {
      "name": "GI_44",
      "type": "Light",
      "x": 0.227303,
      "y": 0.164749
    },
    {
      "name": "GI_45",
      "type": "Light",
      "x": 0.242141,
      "y": 0.122564
    },
    {
      "name": "GI_46",
      "type": "Light",
      "x": 0.242242,
      "y": 0.123562
    },
    {
      "name": "GI_47",
      "type": "Light",
      "x": 0.080921,
      "y": 0.092584
    },
    {
      "name": "GI_48",
      "type": "Light",
      "x": 0.081022,
      "y": 0.093582
    },
    {
      "name": "GI_49",
      "type": "Light",
      "x": 0.212885,
      "y": 0.048875
    },
    {
      "name": "GI_5",
      "type": "Light",
      "x": 0.1612,
      "y": 0.789431
    },
    {
      "name": "GI_50",
      "type": "Light",
      "x": 0.212986,
      "y": 0.049873
    },
    {
      "name": "GI_51",
      "type": "Light",
      "x": 0.419545,
      "y": 0.111637
    },
    {
      "name": "GI_52",
      "type": "Light",
      "x": 0.419647,
      "y": 0.112635
    },
    {
      "name": "GI_53",
      "type": "Light",
      "x": 0.481792,
      "y": 0.081377
    },
    {
      "name": "GI_54",
      "type": "Light",
      "x": 0.481894,
      "y": 0.082375
    },
    {
      "name": "GI_55",
      "type": "Light",
      "x": 0.6399,
      "y": 0.08642
    },
    {
      "name": "GI_56",
      "type": "Light",
      "x": 0.640002,
      "y": 0.097058
    },
    {
      "name": "GI_57",
      "type": "Light",
      "x": 0.955908,
      "y": 0.075462
    },
    {
      "name": "GI_58",
      "type": "Light",
      "x": 0.956009,
      "y": 0.07646
    },
    {
      "name": "GI_59",
      "type": "Light",
      "x": 0.892831,
      "y": 0.054292
    },
    {
      "name": "GI_6",
      "type": "Light",
      "x": 0.160332,
      "y": 0.791883
    },
    {
      "name": "GI_60",
      "type": "Light",
      "x": 0.892932,
      "y": 0.05529
    },
    {
      "name": "GI_61",
      "type": "Light",
      "x": 0.903343,
      "y": 0.226139
    },
    {
      "name": "GI_62",
      "type": "Light",
      "x": 0.903445,
      "y": 0.227137
    },
    {
      "name": "GI_7",
      "type": "Light",
      "x": 0.808039,
      "y": 0.801121
    },
    {
      "name": "GI_8",
      "type": "Light",
      "x": 0.808102,
      "y": 0.802982
    },
    {
      "name": "GI_9",
      "type": "Light",
      "x": 0.755679,
      "y": 0.70626
    },
    {
      "name": "GI_LaneGuide_1",
      "type": "Light",
      "x": 0.671831,
      "y": 0.117594
    },
    {
      "name": "GI_LaneGuide_2",
      "type": "Light",
      "x": 0.759568,
      "y": 0.112083
    },
    {
      "name": "GI_LaneGuide_3",
      "type": "Light",
      "x": 0.847305,
      "y": 0.13137
    },
    {
      "name": "l10",
      "type": "Light",
      "x": 0.468393,
      "y": 0.203185
    },
    {
      "name": "l11",
      "type": "Light",
      "x": 0.474756,
      "y": 0.245996
    },
    {
      "name": "L12",
      "type": "Light",
      "x": 0.527345,
      "y": 0.272436
    },
    {
      "name": "L13",
      "type": "Light",
      "x": 0.452813,
      "y": 0.292349
    },
    {
      "name": "L14",
      "type": "Light",
      "x": 0.339302,
      "y": 0.147727
    },
    {
      "name": "l15",